{"schemaVersion":"1.1.0","generatedAt":"2026-10-22T12:10:50-04:00","editionDate":"2026-10-22","stories":[],"editorial":{"version":1,"generatedAt":"2026-10-22T12:20:58.367507-04:00","days":[{"date":"2026-10-21","selectedIds":[]},{"date":"2026-10-22","selectedIds":[]},{"date":"2026-10-23","selectedIds":[]}],"corrections":[{"id":"newly-counted-ballots-mean-hamtramck-s-m-news-2026-10-22","inputFacts":{"id":"newly-counted-ballots-mean-hamtramck-s-m-news-2026-10-22","title":"Newly counted ballots mean Hamtramck's mayor may have actually lost last year's election","url":"https://www.michiganpublic.org/politics-government/2026-10-16/newly-counted-ballots-mean-hamtramcks-mayor-may-have-actually-lost-last-years-election","publishedAt":"2026-10-22T00:00:00-04:00","summary":"Nearly a year after Hamtramck Mayor Adam Alharbi won his 2025 mayoral race by 11 votes, an additional 37 ballots discovered after the election have reversed the results, giving opponent Muhith Mahmood a 12-vote lead. The Wayne County Board of Canvassers counted the ballots following legal challenges, but Alharbi has filed a lawsuit alleging Mahmood doesn't meet residency requirements. A hearing on this issue is scheduled for October 22, 2026.","finding":null,"sourceUpdatedAt":null},"publishedAt":"2026-10-16T22:37:22.133000-04:00","publicationEvidence":"2026-10-16T22:37:22.133","datePrecision":"time"},{"id":"fact-check-abdul-el-sayed-and-mike-roger-news-2026-10-21","inputFacts":{"id":"fact-check-abdul-el-sayed-and-mike-roger-news-2026-10-21","title":"Fact check: Abdul El-Sayed and Mike Rogers debate Trump, tariffs, war, more","url":"https://bridgemi.com/michigan-government/fact-check-abdul-el-sayed-and-mike-rogers-debate-trump-tariffs-war-more/","publishedAt":"2026-10-21T00:00:00-04:00","summary":"Democrat Abdul El-Sayed and Republican Mike Rogers engaged in a heated debate in Grand Rapids, clashing over tariffs, the Iran war, personal wealth, and policy positions. The candidates are vying to replace retiring Senator Gary Peters in a race that could determine Senate control during Trump's final term. Fact checks address claims about tariff impacts, medical credentials, and financial ties.","finding":null,"sourceUpdatedAt":null},"publishedAt":"2026-10-09T02:04:19+00:00","publicationEvidence":"2026-10-09T02:04:19+00:00","datePrecision":"time"},{"id":"michigan-advocates-work-to-ease-election-news-2026-10-19","inputFacts":{"id":"michigan-advocates-work-to-ease-election-news-2026-10-19","title":"Michigan advocates work to ease election security anxieties as Nov. 3 approaches","url":"https://michiganadvance.com/2026/10/19/michigan-advocates-work-to-ease-election-security-anxieties-as-november-3-approaches/","publishedAt":"2026-10-19T00:00:00-04:00","summary":"With two weeks remaining until the Nov. 3 general election, Michigan advocates and nonprofits are addressing election security concerns through outreach, legal protections, and transparency efforts. Experts emphasize the state's decentralized election system as a security safeguard while monitoring potential federal interference and mail-in voting challenges. Organizations like Common Cause and the Michigan Election Observation Project are deploying hotlines, observers, and educational campaigns to ensure voter confidence.","finding":null,"sourceUpdatedAt":null},"publishedAt":"2026-10-19T09:26:24+00:00","publicationEvidence":"2026-10-19T09:26:24+00:00","datePrecision":"time"},{"id":"how-to-register-to-vote-in-michigan-news-2026-10-20","inputFacts":{"id":"how-to-register-to-vote-in-michigan-news-2026-10-20","title":"How to register to vote in Michigan","url":"https://www.hometownlife.com/story/news/politics/elections/2026/10/13/how-to-register-to-vote-in-michigan-november-election/92215000007/","publishedAt":"2026-10-20T00:00:00-04:00","summary":"The article outlines eligibility requirements and registration methods for voting in Michigan, including in-person, online, and mail options. Voters must be U.S. citizens, Michigan residents for 30 days, and at least 17½ years old. Registration deadlines and required documentation are detailed for the November election.","finding":null,"sourceUpdatedAt":null},"publishedAt":"2026-10-13T10:06:44+00:00","publicationEvidence":"2026-10-13T10:06:44Z","datePrecision":"time"},{"id":"commerce-township-based-outrun-hunger-to-news-2026-10-18","inputFacts":{"id":"commerce-township-based-outrun-hunger-to-news-2026-10-18","title":"Commerce Township-based Outrun Hunger to host ‘Sweet 16 Running Strong’ 5k and 1-mile run to combat hunger","url":"https://www.clickondetroit.com/news/local/2026/10/18/commerce-townships-outrun-hunger-to-host-sweet-16-running-strong-5k-and-1-mile-run-to-combat-hunger/","publishedAt":"2026-10-18T17:19:00-04:00","summary":"Outrun Hunger, a Commerce Township nonprofit, is hosting its 16th annual 5K and 1-mile run/walk on November 14 to combat hunger. The event has raised over $308,000 since 2011, helping nearly 12,000 families through local food pantries. Participants can register for races, volunteer, or donate, with prizes and sponsor gifts available for early registrants.","finding":null,"sourceUpdatedAt":null},"publishedAt":"2026-10-18T21:19:11.008000+00:00","publicationEvidence":"2026-10-18T21:19:11.008Z","datePrecision":"time"},{"id":"family-cleaning-out-home-finds-grenade-w-news-2026-10-17","inputFacts":{"id":"family-cleaning-out-home-finds-grenade-w-news-2026-10-17","title":"Family cleaning out home finds grenade. What happened","url":"https://www.hometownlife.com/story/news/local/michigan/2026/10/17/hand-grenade-family-grandfather-van-buren-kalamazoo/92311540007/","publishedAt":"2026-10-17T21:00:00-04:00","summary":"Family members cleaning out their grandfather's Van Buren County home discovered a World War II-era hand grenade on Oct. 17, 2026. The decommissioned 1945 grenade was safely examined and dismantled by the Kalamazoo Bomb Squad after being reported to authorities at 12:20 p.m. The item was confirmed to have been previously decommissioned after initial uncertainty about its status.","finding":null,"sourceUpdatedAt":null},"publishedAt":"2026-10-18T01:00:29+00:00","publicationEvidence":"2026-10-18T01:00:29Z","datePrecision":"time"},{"id":"do-we-turn-clocks-back-tonight-when-dayl-news-2026-10-17","inputFacts":{"id":"do-we-turn-clocks-back-tonight-when-dayl-news-2026-10-17","title":"Do we turn clocks back tonight? When Daylight Saving Time ends","url":"https://www.hometownlife.com/story/news/local/michigan/2026/10/17/daylight-savings-time-saving-fall-back-clocks/92278987007/","publishedAt":"2026-10-17T06:05:00-04:00","summary":"Daylight Saving Time in Michigan ends at 2 a.m. on Nov. 1, 2026, the first Sunday in November. Digital devices will automatically adjust, but some clocks may need manual changes. The article provides details about the time change and its impact.","finding":null,"sourceUpdatedAt":null},"publishedAt":"2026-10-17T10:05:49+00:00","publicationEvidence":"2026-10-17T10:05:49Z","datePrecision":"time"}]}}