{"schemaVersion":"1.1.0","generatedAt":"2026-10-21T19:03:12-04:00","editionDate":"2026-10-21","stories":[],"editorial":{"version":1,"generatedAt":"2026-10-21T19:03:29.719536-04:00","days":[{"date":"2026-10-20","selectedIds":[]},{"date":"2026-10-21","selectedIds":[]},{"date":"2026-10-22","selectedIds":[]}],"corrections":[{"id":"fact-check-abdul-el-sayed-and-mike-roger-news-2026-10-21","inputFacts":{"id":"fact-check-abdul-el-sayed-and-mike-roger-news-2026-10-21","title":"Fact check: Abdul El-Sayed and Mike Rogers debate Trump, tariffs, war, more","url":"https://bridgemi.com/michigan-government/fact-check-abdul-el-sayed-and-mike-rogers-debate-trump-tariffs-war-more/","publishedAt":"2026-10-21T00:00:00-04:00","summary":"Democrat Abdul El-Sayed and Republican Mike Rogers engaged in a heated debate in Grand Rapids, clashing over tariffs, the Iran war, personal wealth, and policy positions. The candidates are vying to replace retiring Senator Gary Peters in a race that could determine Senate control during Trump's final term. Fact checks address claims about tariff impacts, medical credentials, and financial ties.","finding":null,"sourceUpdatedAt":null},"publishedAt":"2026-10-09T02:04:19+00:00","publicationEvidence":"2026-10-09T02:04:19+00:00","datePrecision":"time"},{"id":"michigan-advocates-work-to-ease-election-news-2026-10-19","inputFacts":{"id":"michigan-advocates-work-to-ease-election-news-2026-10-19","title":"Michigan advocates work to ease election security anxieties as Nov. 3 approaches","url":"https://michiganadvance.com/2026/10/19/michigan-advocates-work-to-ease-election-security-anxieties-as-november-3-approaches/","publishedAt":"2026-10-19T00:00:00-04:00","summary":"With two weeks remaining until the Nov. 3 general election, Michigan advocates and nonprofits are addressing election security concerns through outreach, legal protections, and transparency efforts. Experts emphasize the state's decentralized election system as a security safeguard while monitoring potential federal interference and mail-in voting challenges. Organizations like Common Cause and the Michigan Election Observation Project are deploying hotlines, observers, and educational campaigns to ensure voter confidence.","finding":null,"sourceUpdatedAt":null},"publishedAt":"2026-10-19T09:26:24+00:00","publicationEvidence":"2026-10-19T09:26:24+00:00","datePrecision":"time"},{"id":"how-to-register-to-vote-in-michigan-news-2026-10-20","inputFacts":{"id":"how-to-register-to-vote-in-michigan-news-2026-10-20","title":"How to register to vote in Michigan","url":"https://www.hometownlife.com/story/news/politics/elections/2026/10/13/how-to-register-to-vote-in-michigan-november-election/92215000007/","publishedAt":"2026-10-20T00:00:00-04:00","summary":"The article outlines eligibility requirements and registration methods for voting in Michigan, including in-person, online, and mail options. Voters must be U.S. citizens, Michigan residents for 30 days, and at least 17½ years old. Registration deadlines and required documentation are detailed for the November election.","finding":null,"sourceUpdatedAt":null},"publishedAt":"2026-10-13T10:06:44+00:00","publicationEvidence":"2026-10-13T10:06:44Z","datePrecision":"time"},{"id":"commerce-township-based-outrun-hunger-to-news-2026-10-18","inputFacts":{"id":"commerce-township-based-outrun-hunger-to-news-2026-10-18","title":"Commerce Township-based Outrun Hunger to host ‘Sweet 16 Running Strong’ 5k and 1-mile run to combat hunger","url":"https://www.clickondetroit.com/news/local/2026/10/18/commerce-townships-outrun-hunger-to-host-sweet-16-running-strong-5k-and-1-mile-run-to-combat-hunger/","publishedAt":"2026-10-18T17:19:00-04:00","summary":"Outrun Hunger, a Commerce Township nonprofit, is hosting its 16th annual 5K and 1-mile run/walk on November 14 to combat hunger. The event has raised over $308,000 since 2011, helping nearly 12,000 families through local food pantries. Participants can register for races, volunteer, or donate, with prizes and sponsor gifts available for early registrants.","finding":null,"sourceUpdatedAt":null},"publishedAt":"2026-10-18T21:19:11.008000+00:00","publicationEvidence":"2026-10-18T21:19:11.008Z","datePrecision":"time"},{"id":"family-cleaning-out-home-finds-grenade-w-news-2026-10-17","inputFacts":{"id":"family-cleaning-out-home-finds-grenade-w-news-2026-10-17","title":"Family cleaning out home finds grenade. What happened","url":"https://www.hometownlife.com/story/news/local/michigan/2026/10/17/hand-grenade-family-grandfather-van-buren-kalamazoo/92311540007/","publishedAt":"2026-10-17T21:00:00-04:00","summary":"Family members cleaning out their grandfather's Van Buren County home discovered a World War II-era hand grenade on Oct. 17, 2026. The decommissioned 1945 grenade was safely examined and dismantled by the Kalamazoo Bomb Squad after being reported to authorities at 12:20 p.m. The item was confirmed to have been previously decommissioned after initial uncertainty about its status.","finding":null,"sourceUpdatedAt":null},"publishedAt":"2026-10-18T01:00:29+00:00","publicationEvidence":"2026-10-18T01:00:29Z","datePrecision":"time"},{"id":"do-we-turn-clocks-back-tonight-when-dayl-news-2026-10-17","inputFacts":{"id":"do-we-turn-clocks-back-tonight-when-dayl-news-2026-10-17","title":"Do we turn clocks back tonight? When Daylight Saving Time ends","url":"https://www.hometownlife.com/story/news/local/michigan/2026/10/17/daylight-savings-time-saving-fall-back-clocks/92278987007/","publishedAt":"2026-10-17T06:05:00-04:00","summary":"Daylight Saving Time in Michigan ends at 2 a.m. on Nov. 1, 2026, the first Sunday in November. Digital devices will automatically adjust, but some clocks may need manual changes. The article provides details about the time change and its impact.","finding":null,"sourceUpdatedAt":null},"publishedAt":"2026-10-17T10:05:49+00:00","publicationEvidence":"2026-10-17T10:05:49Z","datePrecision":"time"},{"id":"detroit-media-exec-was-accused-of-postin-news-2026-10-18","inputFacts":{"id":"detroit-media-exec-was-accused-of-postin-news-2026-10-18","title":"Detroit media exec was accused of posting racist meme. Now he owes $62M in discrimination case.","url":"https://www.clickondetroit.com/news/local/2026/10/18/detroit-media-exec-was-accused-of-posting-racist-meme-now-he-owes-62m-in-discrimination-case/","publishedAt":"2026-10-18T05:00:00-04:00","summary":"A federal jury ordered Detroit media executive Kevin Adell and The Word Network to pay Bishop George Bloomer $62.2 million in a discrimination case. The lawsuit alleged Adell created a racially hostile work environment by sharing a racist meme depicting Bloomer and other Black clergy members, leading to Bloomer's 2019 departure. Adell's spokesperson declined to comment after the verdict.","finding":null,"sourceUpdatedAt":null},"publishedAt":"2026-10-18T09:00:00+00:00","publicationEvidence":"2026-10-18T09:00:00Z","datePrecision":"time"},{"id":"how-a-st-clair-county-5-year-old-s-quick-news-2026-10-18","inputFacts":{"id":"how-a-st-clair-county-5-year-old-s-quick-news-2026-10-18","title":"How a St. Clair County 5-year-old’s quick thinking saved his grandmother’s life","url":"https://www.clickondetroit.com/news/local/2026/10/18/how-a-st-clair-county-5-year-olds-quick-thinking-saved-his-grandmothers-life/","publishedAt":"2026-10-18T05:00:00-04:00","summary":"A 5-year-old St. Clair County boy, Hudson Tenn, was honored for saving his grandmother’s life during a medical emergency. Hudson and his 3-year-old sister sought help when their unconscious grandmother fell, leading neighbors to assist and call 911. The incident occurred over the summer, and Hudson was later recognized for his bravery by township officials and the sheriff’s office.","finding":null,"sourceUpdatedAt":null},"publishedAt":"2026-10-18T09:00:00+00:00","publicationEvidence":"2026-10-18T09:00:00Z","datePrecision":"time"}]}}