{"schemaVersion":"1.1.0","generatedAt":"2026-10-25T01:39:14-04:00","editionDate":"2026-10-25","stories":[],"editorial":{"version":1,"generatedAt":"2026-10-25T01:39:38.435067-04:00","days":[{"date":"2026-10-24","selectedIds":[]},{"date":"2026-10-25","selectedIds":[]},{"date":"2026-10-26","selectedIds":[]}],"corrections":[{"id":"michigan-voters-can-request-absentee-bal-news-2026-10-23","inputFacts":{"id":"michigan-voters-can-request-absentee-bal-news-2026-10-23","title":"Michigan voters can request absentee ballots for November election","url":"https://www.hometownlife.com/story/news/politics/elections/2026/09/25/michigan-absentee-ballot-application-request-november-election-deadline/91934863007/","publishedAt":"2026-10-23T00:00:00-04:00","summary":"Voters in Michigan can spoil already submitted absentee ballots by submitting a written request to their local clerk's office. Requests must be signed and specify whether a new ballot should be mailed or picked up in person. The deadline for requests is 5 p.m. on October 23 for the November election. Voters who cast ballots at early voting sites or polling locations cannot spoil their ballots.","finding":null,"sourceUpdatedAt":null},"publishedAt":"2026-09-25T14:47:38+00:00","publicationEvidence":"2026-09-25T14:47:38Z","datePrecision":"time"},{"id":"benson-and-james-clash-over-financial-in-news-2026-10-24","inputFacts":{"id":"benson-and-james-clash-over-financial-in-news-2026-10-24","title":"Benson and James clash over financial integrity, tax plans in final debate","url":"https://www.michigandaily.com/news/government/benson-and-james-clash-over-financial-integrity-tax-plans-in-final-debate/","publishedAt":"2026-10-24T00:00:00-04:00","summary":"Michigan gubernatorial candidates Jocelyn Benson and John James debated in Detroit on October 24, 2026, focusing on tax policies, data center transparency, and economic growth. Benson emphasized affordability and accountability while James highlighted energy cost reduction and experience. Both candidates attacked each other's financial ties to data centers and policy records.","finding":null,"sourceUpdatedAt":null},"publishedAt":"2026-10-18T22:34:17+00:00","publicationEvidence":"2026-10-18T22:34:17+00:00","datePrecision":"time"},{"id":"dingell-balint-and-rheingans-talk-health-news-2026-10-24","inputFacts":{"id":"dingell-balint-and-rheingans-talk-health-news-2026-10-24","title":"Dingell, Balint and Rheingans talk healthcare, social security at Ann Arbor town hall","url":"https://www.michigandaily.com/news/government/dingell-balint-and-rheingans-talk-healthcare-social-security-at-ann-arbor-town-hall/","publishedAt":"2026-10-24T00:00:00-04:00","summary":"Ann Arbor community members gathered at Detroit Street Filling Station for a town hall organized by Abdul El-Sayed’s U.S. Senate campaign. U.S. Rep. Debbie Dingell, U.S. Rep. Becca Balint, and state Rep. Carrie Rheingans discussed threats to Social Security and Medicare from Trump-era budget cuts, emphasizing the need for Medicare for All and voter engagement. Panelists highlighted impacts on small businesses and healthcare accessibility.","finding":null,"sourceUpdatedAt":null},"publishedAt":"2026-10-14T04:54:20+00:00","publicationEvidence":"2026-10-14T04:54:20+00:00","datePrecision":"time"},{"id":"republicans-put-spotlight-on-abdul-el-sa-news-2026-10-24","inputFacts":{"id":"republicans-put-spotlight-on-abdul-el-sa-news-2026-10-24","title":"Republicans put spotlight on Abdul El-Sayed. He welcomes the fight","url":"https://bridgemi.com/michigan-government/republicans-put-spotlight-on-abdul-el-sayed-he-welcomes-the-fight/","publishedAt":"2026-10-24T00:00:00-04:00","summary":"Abdul El-Sayed, the Democratic U.S. Senate candidate in Michigan, faces intense Republican attacks portraying him as a radical, while embracing a confrontational campaign style. The race, one of the nation's most consequential, features a Republican spending advantage and national stakes, with figures like Alexandria Ocasio-Cortez and Barack Obama planning to campaign for El-Sayed. His approach has divided Democrats but energized progressive supporters.","finding":null,"sourceUpdatedAt":null},"publishedAt":"2026-10-12T14:15:00+00:00","publicationEvidence":"2026-10-12T14:15:00+00:00","datePrecision":"time"},{"id":"saroki-s-is-giving-away-free-pizza-and-c-news-2026-10-24","inputFacts":{"id":"saroki-s-is-giving-away-free-pizza-and-c-news-2026-10-24","title":"Saroki’s is giving away free pizza and chicken across Michigan","url":"https://www.metrotimes.com/food-drink/sarokis-is-giving-away-free-pizza-and-chicken-across-michigan/","publishedAt":"2026-10-24T00:00:00-04:00","summary":"Saroki’s Crispy Chicken & Pizza is offering free food at all 22 Michigan locations on October 24 as a thank-you to customers. From 11 a.m.-5 p.m., customers can receive one pizza slice, one chicken tender, and a side of sauce while supplies last. Founder Todd Saroki stated the event aims to show appreciation for community support over 15 years.","finding":null,"sourceUpdatedAt":null},"publishedAt":"2026-10-07T16:41:28+00:00","publicationEvidence":"2026-10-07T16:41:28+00:00","datePrecision":"time"},{"id":"grammy-award-winning-singer-samara-joy-p-news-2026-10-23","inputFacts":{"id":"grammy-award-winning-singer-samara-joy-p-news-2026-10-23","title":"Grammy Award-winning singer Samara Joy performs at Hill Auditorium","url":"https://www.michigandaily.com/news/campus-life/grammy-award-winning-singer-samara-joy-performs-at-hill-auditorium/","publishedAt":"2026-10-23T00:00:00-04:00","summary":"Grammy Award-winning jazz singer Samara Joy performed at the University of Michigan’s Hill Auditorium as part of her 2026 world tour promoting her upcoming EP. The concert, organized by the University Musical Society, featured songs from her albums and a preview of her new EP, with Joy emphasizing the preparation and chemistry of her septet. Attendees praised the emotional and enlightening experience of witnessing her live performance.","finding":null,"sourceUpdatedAt":null},"publishedAt":"2026-10-13T04:07:09+00:00","publicationEvidence":"2026-10-13T04:07:09+00:00","datePrecision":"time"},{"id":"absentee-ballots-going-out-in-michigan-w-news-2026-10-24","inputFacts":{"id":"absentee-ballots-going-out-in-michigan-w-news-2026-10-24","title":"Absentee Ballots Going Out in Michigan: What to Know","url":"https://bridgemi.com/michigan-government/absentee-ballots-going-out-in-michigan-what-to-know/","publishedAt":"2026-10-24T00:00:00-04:00","summary":"Michigan requires local communities to offer at least nine days of early in-person voting, a change approved by voters in 2022. Early voting will start on Oct. 24 in most areas, or earlier in some locations where clerks allow additional days.","finding":null,"sourceUpdatedAt":null},"publishedAt":"2026-09-24T20:00:07+00:00","publicationEvidence":"2026-09-24T20:00:07+00:00","datePrecision":"time"},{"id":"detroit-based-singer-songwriter-christia-news-2026-10-23","inputFacts":{"id":"detroit-based-singer-songwriter-christia-news-2026-10-23","title":"Detroit-based singer-songwriter Christian Ohly is finding his way back to the light","url":"https://www.metrotimes.com/music-2/detroit-based-singer-songwriter-christian-ohly-is-finding-his-way-back-to-the-light/","publishedAt":"2026-10-23T00:00:00-04:00","summary":"Detroit-based indie-folk artist Christian Ohly is hosting an album release party for his second full-length, *Light Again*, on Oct. 23 at the Magic Bag in Ferndale. The event marks a pivotal moment in his decade-long Michigan music career, reflecting his growth as a songwriter and performer influenced by artists like The Head and the Heart and Dan Zott of Jr. Jr.","finding":null,"sourceUpdatedAt":null},"publishedAt":"2026-10-15T14:17:31+00:00","publicationEvidence":"2026-10-15T14:17:31+00:00","datePrecision":"time"},{"id":"newly-counted-ballots-mean-hamtramck-s-m-news-2026-10-22","inputFacts":{"id":"newly-counted-ballots-mean-hamtramck-s-m-news-2026-10-22","title":"Newly counted ballots mean Hamtramck's mayor may have actually lost last year's election","url":"https://www.michiganpublic.org/politics-government/2026-10-16/newly-counted-ballots-mean-hamtramcks-mayor-may-have-actually-lost-last-years-election","publishedAt":"2026-10-22T00:00:00-04:00","summary":"Nearly a year after Hamtramck Mayor Adam Alharbi won his 2025 mayoral race by 11 votes, an additional 37 ballots discovered after the election have reversed the results, giving opponent Muhith Mahmood a 12-vote lead. The Wayne County Board of Canvassers counted the ballots following legal challenges, but Alharbi has filed a lawsuit alleging Mahmood doesn't meet residency requirements. A hearing on this issue is scheduled for October 22, 2026.","finding":null,"sourceUpdatedAt":null},"publishedAt":"2026-10-16T22:37:22.133000-04:00","publicationEvidence":"2026-10-16T22:37:22.133","datePrecision":"time"}]}}