{"schemaVersion":"1.1.0","generatedAt":"2026-10-28T16:50:01-04:00","editionDate":"2026-10-28","stories":[],"editorial":{"version":1,"generatedAt":"2026-10-28T16:50:47.700637-04:00","days":[{"date":"2026-10-27","selectedIds":[]},{"date":"2026-10-28","selectedIds":[]},{"date":"2026-10-29","selectedIds":[]}],"corrections":[{"id":"detroit-woman-sexually-exploited-traffic-news-2026-10-27","inputFacts":{"id":"detroit-woman-sexually-exploited-traffic-news-2026-10-27","title":"Detroit woman sexually exploited, trafficked missing 16-year-old girl, feds say","url":"https://www.clickondetroit.com/news/local/2026/10/09/detroit-woman-sexually-exploited-trafficked-missing-16-year-old-girl-feds-say/","publishedAt":"2026-10-27T00:00:00-04:00","summary":"Federal authorities allege a Detroit woman sexually exploited and trafficked a missing 16-year-old girl. Investigators identified the suspect, Jasmina Vukojevic, through a tattooed hand image and selfie-style photos on her phone. She is scheduled to appear in federal court on Oct. 27 for a status conference and has prior convictions for weapons and drug charges in Wayne and Macomb counties.","finding":null,"sourceUpdatedAt":null},"publishedAt":"2026-10-09T09:00:01+00:00","publicationEvidence":"2026-10-09T09:00:01Z","datePrecision":"time"},{"id":"sacua-discusses-statement-of-student-rig-news-2026-10-26","inputFacts":{"id":"sacua-discusses-statement-of-student-rig-news-2026-10-26","title":"SACUA discusses Statement of Student Rights and Responsibilities amendments, faculty housing","url":"https://www.michigandaily.com/news/academics/sacua-discusses-statement-of-student-rights-and-responsibilities-amendments-faculty-housing/","publishedAt":"2026-10-26T00:00:00-04:00","summary":"The University of Michigan’s Senate Advisory Committee on University Affairs met to discuss amending the Statement of Student Rights and Responsibilities and addressing faculty housing challenges amid Ann Arbor’s housing affordability crisis. SACUA Chair Kentaro Toyama highlighted enrollment demographic shifts and plans to collaborate with Central Student Government following a sexual assault case at Cornell University. The committee approved 22 of 28 proposed amendments to student rights policies and plans to revisit faculty housing recommendations after gathering more data on salaries and housing costs.","finding":null,"sourceUpdatedAt":null},"publishedAt":"2026-10-13T05:01:16+00:00","publicationEvidence":"2026-10-13T05:01:16+00:00","datePrecision":"time"},{"id":"why-mailing-a-ballot-close-to-election-d-news-2026-10-26","inputFacts":{"id":"why-mailing-a-ballot-close-to-election-d-news-2026-10-26","title":"Why mailing a ballot close to Election Day may get it rejected for a late postmark","url":"https://www.wemu.org/npr-national-news/2026-10-09/why-mailing-a-ballot-close-to-election-day-may-get-it-rejected-for-a-late-postmark","publishedAt":"2026-10-26T00:00:00-04:00","summary":"USPS's 'Regional Transportation Optimization' plan, implemented since April 2025, has reduced mail pick-ups and altered postmark procedures, risking late postmarks for ballots. USPS is taking 'extraordinary measures' to manually postmark ballots starting Oct. 26, but analysts warn of potential ballot rejections due to unclear implementation and staffing challenges.","finding":null,"sourceUpdatedAt":null},"publishedAt":"2026-10-09T09:00:00-04:00","publicationEvidence":"2026-10-09T09:00:00","datePrecision":"time"},{"id":"michigan-voters-can-request-absentee-bal-news-2026-10-23","inputFacts":{"id":"michigan-voters-can-request-absentee-bal-news-2026-10-23","title":"Michigan voters can request absentee ballots for November election","url":"https://www.hometownlife.com/story/news/politics/elections/2026/09/25/michigan-absentee-ballot-application-request-november-election-deadline/91934863007/","publishedAt":"2026-10-23T00:00:00-04:00","summary":"Voters in Michigan can spoil already submitted absentee ballots by submitting a written request to their local clerk's office. Requests must be signed and specify whether a new ballot should be mailed or picked up in person. The deadline for requests is 5 p.m. on October 23 for the November election. Voters who cast ballots at early voting sites or polling locations cannot spoil their ballots.","finding":null,"sourceUpdatedAt":null},"publishedAt":"2026-09-25T14:47:38+00:00","publicationEvidence":"2026-09-25T14:47:38Z","datePrecision":"time"},{"id":"benson-and-james-clash-over-financial-in-news-2026-10-24","inputFacts":{"id":"benson-and-james-clash-over-financial-in-news-2026-10-24","title":"Benson and James clash over financial integrity, tax plans in final debate","url":"https://www.michigandaily.com/news/government/benson-and-james-clash-over-financial-integrity-tax-plans-in-final-debate/","publishedAt":"2026-10-24T00:00:00-04:00","summary":"Michigan gubernatorial candidates Jocelyn Benson and John James debated in Detroit on October 24, 2026, focusing on tax policies, data center transparency, and economic growth. Benson emphasized affordability and accountability while James highlighted energy cost reduction and experience. Both candidates attacked each other's financial ties to data centers and policy records.","finding":null,"sourceUpdatedAt":null},"publishedAt":"2026-10-18T22:34:17+00:00","publicationEvidence":"2026-10-18T22:34:17+00:00","datePrecision":"time"},{"id":"dingell-balint-and-rheingans-talk-health-news-2026-10-24","inputFacts":{"id":"dingell-balint-and-rheingans-talk-health-news-2026-10-24","title":"Dingell, Balint and Rheingans talk healthcare, social security at Ann Arbor town hall","url":"https://www.michigandaily.com/news/government/dingell-balint-and-rheingans-talk-healthcare-social-security-at-ann-arbor-town-hall/","publishedAt":"2026-10-24T00:00:00-04:00","summary":"Ann Arbor community members gathered at Detroit Street Filling Station for a town hall organized by Abdul El-Sayed’s U.S. Senate campaign. U.S. Rep. Debbie Dingell, U.S. Rep. Becca Balint, and state Rep. Carrie Rheingans discussed threats to Social Security and Medicare from Trump-era budget cuts, emphasizing the need for Medicare for All and voter engagement. Panelists highlighted impacts on small businesses and healthcare accessibility.","finding":null,"sourceUpdatedAt":null},"publishedAt":"2026-10-14T04:54:20+00:00","publicationEvidence":"2026-10-14T04:54:20+00:00","datePrecision":"time"},{"id":"republicans-put-spotlight-on-abdul-el-sa-news-2026-10-24","inputFacts":{"id":"republicans-put-spotlight-on-abdul-el-sa-news-2026-10-24","title":"Republicans put spotlight on Abdul El-Sayed. He welcomes the fight","url":"https://bridgemi.com/michigan-government/republicans-put-spotlight-on-abdul-el-sayed-he-welcomes-the-fight/","publishedAt":"2026-10-24T00:00:00-04:00","summary":"Abdul El-Sayed, the Democratic U.S. Senate candidate in Michigan, faces intense Republican attacks portraying him as a radical, while embracing a confrontational campaign style. The race, one of the nation's most consequential, features a Republican spending advantage and national stakes, with figures like Alexandria Ocasio-Cortez and Barack Obama planning to campaign for El-Sayed. His approach has divided Democrats but energized progressive supporters.","finding":null,"sourceUpdatedAt":null},"publishedAt":"2026-10-12T14:15:00+00:00","publicationEvidence":"2026-10-12T14:15:00+00:00","datePrecision":"time"},{"id":"saroki-s-is-giving-away-free-pizza-and-c-news-2026-10-24","inputFacts":{"id":"saroki-s-is-giving-away-free-pizza-and-c-news-2026-10-24","title":"Saroki’s is giving away free pizza and chicken across Michigan","url":"https://www.metrotimes.com/food-drink/sarokis-is-giving-away-free-pizza-and-chicken-across-michigan/","publishedAt":"2026-10-24T00:00:00-04:00","summary":"Saroki’s Crispy Chicken & Pizza is offering free food at all 22 Michigan locations on October 24 as a thank-you to customers. From 11 a.m.-5 p.m., customers can receive one pizza slice, one chicken tender, and a side of sauce while supplies last. Founder Todd Saroki stated the event aims to show appreciation for community support over 15 years.","finding":null,"sourceUpdatedAt":null},"publishedAt":"2026-10-07T16:41:28+00:00","publicationEvidence":"2026-10-07T16:41:28+00:00","datePrecision":"time"},{"id":"grammy-award-winning-singer-samara-joy-p-news-2026-10-23","inputFacts":{"id":"grammy-award-winning-singer-samara-joy-p-news-2026-10-23","title":"Grammy Award-winning singer Samara Joy performs at Hill Auditorium","url":"https://www.michigandaily.com/news/campus-life/grammy-award-winning-singer-samara-joy-performs-at-hill-auditorium/","publishedAt":"2026-10-23T00:00:00-04:00","summary":"Grammy Award-winning jazz singer Samara Joy performed at the University of Michigan’s Hill Auditorium as part of her 2026 world tour promoting her upcoming EP. The concert, organized by the University Musical Society, featured songs from her albums and a preview of her new EP, with Joy emphasizing the preparation and chemistry of her septet. Attendees praised the emotional and enlightening experience of witnessing her live performance.","finding":null,"sourceUpdatedAt":null},"publishedAt":"2026-10-13T04:07:09+00:00","publicationEvidence":"2026-10-13T04:07:09+00:00","datePrecision":"time"}]}}