{"schemaVersion":"1.1.0","generatedAt":"2026-10-14T15:55:17-04:00","editionDate":"2026-10-14","stories":[{"id":"pcep-peer-to-peer-program-promotes-inclu-news-2026-10-12","title":"PCEP Peer to Peer Program Promotes Inclusive Environment","summary":"The Plymouth-Canton Community Schools' Peer to Peer Program at PCEP fosters an inclusive environment by pairing general education students with special education students for activities like learning, music, and social events. The program, which has a broad research base, aims to create meaningful connections and develop skills for all participants, with plans to expand into areas like team games and entrepreneurship.","url":"https://plymouthlibrary.substack.com/p/pcep-peer-to-peer-program-promotes","publishedAt":"2026-10-12T14:02:09+00:00","addedAt":"2026-10-13T13:00:14-04:00","urgentLocal":false,"evidenceQuality":"reported","entities":["Jacklyn Klotz","Plymouth Canton Community Schools (P-CCS)","Plymouth Canton Education Park (PCEP)","National Clearinghouse on Autism Evidence and Practice (NCAEP)"],"locations":["Plymouth, MI"],"localityIndex":0,"topics":["education","inclusion","special education","student programs","peer interaction","community"],"source":{"name":"Daniel O’Karma","publication":"Plymouth District Library"},"scoring":{"signals":{"funny":0.12,"distinctive":0.25,"eclectic":0.4,"technical_science":0.06,"artsy":0.25,"progressive":0.86,"outdoors":0.03,"theatre":0.02,"live_music":0.05,"live_comedy":0.01,"farmer_market":0.02,"sporting":0.02,"recurring":0.84,"craft_fair_shopping":0.01,"religious":0.02,"large_venue":0.04,"substance_recovery":0.01,"popular_music_cover_band":0.04,"market_or_shop":0.01,"punk_metal_or_rock":0.02,"dance":0.04,"sales_related":0.06,"children_activity":0.07,"running":0.01,"exercise":0.02,"employment_related":0.02}},"photo":{"url":"https://substackcdn.com/image/fetch/$s_!EBVG!,f_auto,q_auto:best,fl_progressive:steep/https%3A%2F%2Fplymouthlibrary.substack.com%2Ftwitter%2Fsubscribe-card.jpg%3Fv%3D1813632301%26version%3D9","alt":"PCEP Peer to Peer Program Promotes Inclusive Environment"},"editorial":{"state":"verified","reviewedAt":"2026-10-14T14:00:41.483616-04:00","expiresAt":"2026-10-17T14:00:41.483616-04:00","inputFacts":{"id":"pcep-peer-to-peer-program-promotes-inclu-news-2026-10-12","title":"PCEP Peer to Peer Program Promotes Inclusive Environment","url":"https://plymouthlibrary.substack.com/p/pcep-peer-to-peer-program-promotes","publishedAt":"2026-10-12T00:00:00-04:00","summary":"The Peer to Peer Program at Plymouth Canton Education Park (PCEP) fosters inclusive connections between students with and without disabilities through collaborative activities like quizzes, music sessions, and social events. Led by Jacklyn Klotz and special education teachers, the program is recognized as an Evidence-Based Practice for students with disabilities and aims to expand with new initiatives like team games and entrepreneurship training.","finding":null,"sourceUpdatedAt":null},"policyKey":"fae75a7c8c5de67ba8af31f88f9db6437b6d3257b9d2241afffcfba51d83d1b6","publicationEvidence":"2026-10-12T14:02:09+00:00","datePrecision":"time","sourceHash":"3c32864805e715ba026a98a2603d17dcef77891250f670ca351b3c72af40cc87","relevance":4,"novelty":3,"reason":"This article describes a specific program within the local school district that directly impacts students in Canton and Plymouth, promoting inclusion and skill development. It details current activities and future plans, making it relevant to the community.","storyKey":"pcep-peer-to-peer-program","localConnection":"The program is run within the Plymouth Canton Community Schools (P-CCS) at the Plymouth Canton Education Park (PCEP), directly serving students in Canton and Plymouth.","grounded":true,"groundingReason":"The article fully supports all claims made in the summary, detailing the program's activities, goals, research basis, and future expansion plans. The program is a local development for Plymouth-Canton Community Schools."}}],"editorial":{"version":1,"generatedAt":"2026-10-14T14:09:54.431952-04:00","days":[{"date":"2026-10-13","selectedIds":["michigan-drivers-to-see-lower-fees-for-c-news-2026-10-12","pcep-peer-to-peer-program-promotes-inclu-news-2026-10-12"]},{"date":"2026-10-14","selectedIds":["michigan-drivers-to-see-lower-fees-for-c-news-2026-10-12","pcep-peer-to-peer-program-promotes-inclu-news-2026-10-12"]},{"date":"2026-10-15","selectedIds":["michigan-drivers-to-see-lower-fees-for-c-news-2026-10-12","pcep-peer-to-peer-program-promotes-inclu-news-2026-10-12"]}],"corrections":[{"id":"michigan-drivers-to-see-lower-fees-for-c-news-2026-10-12","inputFacts":{"id":"michigan-drivers-to-see-lower-fees-for-c-news-2026-10-12","title":"Michigan drivers to see lower fees for catastrophic coverage. How much?","url":"https://www.hometownlife.com/story/news/local/michigan/2026/10/12/michigan-catastrophic-claims-association-lower-assessment-fee-auto-medical-insurance-policyholders/92217883007/","publishedAt":"2026-10-12T14:22:00-04:00","summary":"Michigan drivers with catastrophic auto insurance coverage will see lower assessment fees starting next year due to auto insurance reforms. The Michigan Catastrophic Claims Association announced a $63 pure premium charge and $10 deficit recoupment charge for fiscal year 2027-28, down from current rates of $65 and $19. The reduction follows bipartisan auto no-fault legislation signed by Governor Gretchen Whitmer in 2019.","finding":null,"sourceUpdatedAt":null},"publishedAt":"2026-10-12T18:22:33+00:00","publicationEvidence":"2026-10-12T18:22:33Z","datePrecision":"time"},{"id":"pcep-peer-to-peer-program-promotes-inclu-news-2026-10-12","inputFacts":{"id":"pcep-peer-to-peer-program-promotes-inclu-news-2026-10-12","title":"PCEP Peer to Peer Program Promotes Inclusive Environment","url":"https://plymouthlibrary.substack.com/p/pcep-peer-to-peer-program-promotes","publishedAt":"2026-10-12T00:00:00-04:00","summary":"The Peer to Peer Program at Plymouth Canton Education Park (PCEP) fosters inclusive connections between students with and without disabilities through collaborative activities like quizzes, music sessions, and social events. Led by Jacklyn Klotz and special education teachers, the program is recognized as an Evidence-Based Practice for students with disabilities and aims to expand with new initiatives like team games and entrepreneurship training.","finding":null,"sourceUpdatedAt":null},"publishedAt":"2026-10-12T14:02:09+00:00","publicationEvidence":"2026-10-12T14:02:09+00:00","datePrecision":"time"},{"id":"michigan-regulators-ok-dte-contracts-for-news-2026-10-14","inputFacts":{"id":"michigan-regulators-ok-dte-contracts-for-news-2026-10-14","title":"Michigan regulators OK DTE contracts for Google data center","url":"https://planetdetroit.org/2026/10/dte-google-data-center-contract-approval/","publishedAt":"2026-10-14T00:00:00-04:00","summary":"Michigan regulators approved DTE Energy contracts to power Google’s 1-gigawatt data center in Van Buren Township, with conditions to protect existing utility customers. The Wayne County Commission also overrode a veto to grant Google a tax exemption. Critics and Michigan Attorney General Dana Nessel raised concerns about potential stranded assets and grid reliability risks.","finding":null,"sourceUpdatedAt":null},"publishedAt":"2026-10-01T19:19:31+00:00","publicationEvidence":"2026-10-01T19:19:31+00:00","datePrecision":"time"},{"id":"judge-revokes-bond-for-kim-mathers-ex-wi-news-2026-10-14","inputFacts":{"id":"judge-revokes-bond-for-kim-mathers-ex-wi-news-2026-10-14","title":"Judge revokes bond for Kim Mathers, ex-wife of Eminem, after heated court hearing","url":"https://www.clickondetroit.com/news/local/2026/10/07/judge-revokes-bond-for-kim-mathers-ex-wife-of-eminem-after-heated-court-hearing/","publishedAt":"2026-10-14T00:00:00-04:00","summary":"Judge Hackel revoked Kim Mathers' bond after a heated court hearing, citing her attorney's failure to address bond redetermination promptly. Prosecutors alleged her attorney sought a specific magistrate and delayed action during her 37-day absence. Mathers is scheduled for a probable cause conference on October 14.","finding":null,"sourceUpdatedAt":null},"publishedAt":"2026-10-07T17:16:12.852000+00:00","publicationEvidence":"2026-10-07T17:16:12.852Z","datePrecision":"time"}]}}